{
  "$schema": "https://json-schema.org/draft/2020-12/schema",
  "$id": "https://superspace.dev/schemas/studio/ui.schema.json",
  "title": "StudioUISchema",
  "description": "SuperSpace Studio UI Layout document schema v0.4/v0.5",
  "type": "object",
  "required": ["version", "root", "nodes"],
  "additionalProperties": true,
  "properties": {
    "version": {
      "type": "string",
      "enum": ["0.4", "0.5"],
      "description": "Schema version. New documents must use '0.5'."
    },
    "root": {
      "type": "array",
      "minItems": 1,
      "items": { "$ref": "#/$defs/NodeId" },
      "description": "Ordered list of top-level node IDs."
    },
    "nodes": {
      "type": "object",
      "minProperties": 1,
      "additionalProperties": { "$ref": "#/$defs/SchemaNode" },
      "description": "All nodes keyed by stable node ID."
    },
    "metadata": {
      "type": "object",
      "additionalProperties": true,
      "properties": {
        "id":          { "type": "string" },
        "name":        { "type": "string", "maxLength": 200 },
        "description": { "type": "string", "maxLength": 1000 },
        "author":      { "type": "string" },
        "tags":        { "type": "array", "items": { "type": "string", "maxLength": 50 }, "maxItems": 20 },
        "version":     { "type": "string" },
        "createdAt":   { "type": "string", "format": "date-time" },
        "updatedAt":   { "type": "string", "format": "date-time" },
        "workspaceId": { "type": "string" },
        "projectId":   { "type": "string" },
        "isTemplate":  { "type": "boolean" },
        "generatedBy": { "type": "string" },
        "$schema":     { "type": "string", "format": "uri" }
      }
    }
  },

  "$defs": {
    "NodeId": {
      "type": "string",
      "minLength": 2,
      "maxLength": 64,
      "pattern": "^[a-z][a-z0-9]*(?:-[a-z0-9]+)*$",
      "description": "kebab-case node ID: lowercase letters, digits, hyphens. Must start with a letter."
    },

    "SchemaNode": {
      "type": "object",
      "required": ["type"],
      "additionalProperties": false,
      "properties": {
        "type": {
          "type": "string",
          "minLength": 1,
          "description": "Widget type key. Must be a registered type."
        },
        "props": {
          "type": "object",
          "additionalProperties": true,
          "description": "Widget props. Content validated per-widget by runtime validator."
        },
        "children": {
          "type": "array",
          "items": { "$ref": "#/$defs/NodeId" },
          "uniqueItems": true,
          "description": "Ordered child node IDs. Runtime validator checks existence and graph invariants."
        }
      }
    }
  },

  "note:runtime-only-rules": [
    "All root IDs must exist in nodes (UNKNOWN_ROOT_ID)",
    "All children IDs must exist in nodes (UNKNOWN_CHILD_ID)",
    "No circular references (CIRCULAR_REFERENCE)",
    "Each node may appear in at most one parent's children (MULTIPLE_PARENTS)",
    "Root nodes must not appear as children (ROOT_HAS_PARENT)",
    "All nodes must be reachable from root (ORPHAN_NODE)",
    "Smart blocks may not contain smart blocks (SMART_BLOCK_NESTING)"
  ]
}
